{
  "$schema": "https://json-schema.org/draft/2020-12/schema",
  "$id": "https://agentnest.example/protocol/schema/envelope.schema.json",
  "title": "Envelope",
  "description": "protocol.md 2. Dispatches payload by type via if/then (unknown types pass untyped). Replayable types require seq.",
  "type": "object",
  "properties": {
    "v": {
      "const": 1,
      "description": "protocol major version; mismatch -> E_PROTO_VERSION + close 4010"
    },
    "type": {
      "type": "string",
      "minLength": 1,
      "maxLength": 64,
      "description": "message type; unknown types are silently ignored (forward compatible) so the schema only types the known ones"
    },
    "id": {
      "$ref": "model/common.schema.json#/$defs/Uuid7"
    },
    "ts": {
      "$ref": "model/common.schema.json#/$defs/Timestamp"
    },
    "seq": {
      "$ref": "model/common.schema.json#/$defs/Seq"
    },
    "payload": {
      "type": "object"
    }
  },
  "required": [
    "v",
    "type",
    "id",
    "ts",
    "payload"
  ],
  "allOf": [
    {
      "if": {
        "properties": {
          "type": {
            "const": "pair"
          }
        },
        "required": [
          "type"
        ]
      },
      "then": {
        "properties": {
          "payload": {
            "$ref": "c2s/pair.schema.json"
          }
        }
      }
    },
    {
      "if": {
        "properties": {
          "type": {
            "const": "hello"
          }
        },
        "required": [
          "type"
        ]
      },
      "then": {
        "properties": {
          "payload": {
            "$ref": "c2s/hello.schema.json"
          }
        }
      }
    },
    {
      "if": {
        "properties": {
          "type": {
            "const": "ack"
          }
        },
        "required": [
          "type"
        ]
      },
      "then": {
        "properties": {
          "payload": {
            "$ref": "c2s/ack.schema.json"
          }
        }
      }
    },
    {
      "if": {
        "properties": {
          "type": {
            "const": "ping"
          }
        },
        "required": [
          "type"
        ]
      },
      "then": {
        "properties": {
          "payload": {
            "$ref": "c2s/ping.schema.json"
          }
        }
      }
    },
    {
      "if": {
        "properties": {
          "type": {
            "const": "snapshot_request"
          }
        },
        "required": [
          "type"
        ]
      },
      "then": {
        "properties": {
          "payload": {
            "$ref": "c2s/snapshot_request.schema.json"
          }
        }
      }
    },
    {
      "if": {
        "properties": {
          "type": {
            "const": "events_request"
          }
        },
        "required": [
          "type"
        ]
      },
      "then": {
        "properties": {
          "payload": {
            "$ref": "c2s/events_request.schema.json"
          }
        }
      }
    },
    {
      "if": {
        "properties": {
          "type": {
            "const": "decision"
          }
        },
        "required": [
          "type"
        ]
      },
      "then": {
        "properties": {
          "payload": {
            "$ref": "c2s/decision.schema.json"
          }
        }
      }
    },
    {
      "if": {
        "properties": {
          "type": {
            "const": "approval_seen"
          }
        },
        "required": [
          "type"
        ]
      },
      "then": {
        "properties": {
          "payload": {
            "$ref": "c2s/approval_seen.schema.json"
          }
        }
      }
    },
    {
      "if": {
        "properties": {
          "type": {
            "const": "unpair"
          }
        },
        "required": [
          "type"
        ]
      },
      "then": {
        "properties": {
          "payload": {
            "$ref": "c2s/unpair.schema.json"
          }
        }
      }
    },
    {
      "if": {
        "properties": {
          "type": {
            "const": "challenge"
          }
        },
        "required": [
          "type"
        ]
      },
      "then": {
        "properties": {
          "payload": {
            "$ref": "s2c/challenge.schema.json"
          }
        }
      }
    },
    {
      "if": {
        "properties": {
          "type": {
            "const": "pair_pending"
          }
        },
        "required": [
          "type"
        ]
      },
      "then": {
        "properties": {
          "payload": {
            "$ref": "s2c/pair_pending.schema.json"
          }
        }
      }
    },
    {
      "if": {
        "properties": {
          "type": {
            "const": "pair_result"
          }
        },
        "required": [
          "type"
        ]
      },
      "then": {
        "properties": {
          "payload": {
            "$ref": "s2c/pair_result.schema.json"
          }
        }
      }
    },
    {
      "if": {
        "properties": {
          "type": {
            "const": "welcome"
          }
        },
        "required": [
          "type"
        ]
      },
      "then": {
        "properties": {
          "payload": {
            "$ref": "s2c/welcome.schema.json"
          }
        }
      }
    },
    {
      "if": {
        "properties": {
          "type": {
            "const": "snapshot"
          }
        },
        "required": [
          "type"
        ]
      },
      "then": {
        "properties": {
          "payload": {
            "$ref": "s2c/snapshot.schema.json"
          }
        },
        "required": [
          "seq"
        ]
      }
    },
    {
      "if": {
        "properties": {
          "type": {
            "const": "event"
          }
        },
        "required": [
          "type"
        ]
      },
      "then": {
        "properties": {
          "payload": {
            "$ref": "s2c/event.schema.json"
          }
        },
        "required": [
          "seq"
        ]
      }
    },
    {
      "if": {
        "properties": {
          "type": {
            "const": "session_state"
          }
        },
        "required": [
          "type"
        ]
      },
      "then": {
        "properties": {
          "payload": {
            "$ref": "s2c/session_state.schema.json"
          }
        },
        "required": [
          "seq"
        ]
      }
    },
    {
      "if": {
        "properties": {
          "type": {
            "const": "approval_request"
          }
        },
        "required": [
          "type"
        ]
      },
      "then": {
        "properties": {
          "payload": {
            "$ref": "s2c/approval_request.schema.json"
          }
        },
        "required": [
          "seq"
        ]
      }
    },
    {
      "if": {
        "properties": {
          "type": {
            "const": "approval_resolved"
          }
        },
        "required": [
          "type"
        ]
      },
      "then": {
        "properties": {
          "payload": {
            "$ref": "s2c/approval_resolved.schema.json"
          }
        },
        "required": [
          "seq"
        ]
      }
    },
    {
      "if": {
        "properties": {
          "type": {
            "const": "decision_result"
          }
        },
        "required": [
          "type"
        ]
      },
      "then": {
        "properties": {
          "payload": {
            "$ref": "s2c/decision_result.schema.json"
          }
        }
      }
    },
    {
      "if": {
        "properties": {
          "type": {
            "const": "events_page"
          }
        },
        "required": [
          "type"
        ]
      },
      "then": {
        "properties": {
          "payload": {
            "$ref": "s2c/events_page.schema.json"
          }
        }
      }
    },
    {
      "if": {
        "properties": {
          "type": {
            "const": "hosts_update"
          }
        },
        "required": [
          "type"
        ]
      },
      "then": {
        "properties": {
          "payload": {
            "$ref": "s2c/hosts_update.schema.json"
          }
        }
      }
    },
    {
      "if": {
        "properties": {
          "type": {
            "const": "adapter_status"
          }
        },
        "required": [
          "type"
        ]
      },
      "then": {
        "properties": {
          "payload": {
            "$ref": "s2c/adapter_status.schema.json"
          }
        },
        "required": [
          "seq"
        ]
      }
    },
    {
      "if": {
        "properties": {
          "type": {
            "const": "pong"
          }
        },
        "required": [
          "type"
        ]
      },
      "then": {
        "properties": {
          "payload": {
            "$ref": "s2c/pong.schema.json"
          }
        }
      }
    },
    {
      "if": {
        "properties": {
          "type": {
            "const": "error"
          }
        },
        "required": [
          "type"
        ]
      },
      "then": {
        "properties": {
          "payload": {
            "$ref": "s2c/error.schema.json"
          }
        }
      }
    },
    {
      "if": {
        "properties": {
          "type": {
            "const": "bye"
          }
        },
        "required": [
          "type"
        ]
      },
      "then": {
        "properties": {
          "payload": {
            "$ref": "s2c/bye.schema.json"
          }
        }
      }
    }
  ]
}
