{
  "v": 1,
  "type": "decision_result",
  "id": "01929f2a-7c00-7b3c-9e4d-000000000086",
  "ts": "2026-10-15T09:12:33.120Z",
  "payload": {
    "request_id": "ar_01929f1a-6c2e-7b3c-9e4d-00000000001a",
    "in_reply_to": "01929f2b-0000-7b3c-9e4d-00000000c3d2",
    "accepted": true,
    "reason": "APPLIED",
    "message_ko": "허용했어요. Claude Code에 전달했어요."
  }
}
