{
  "v": 1,
  "type": "events_request",
  "id": "01929f2a-7c00-7b3c-9e4d-00000000006e",
  "ts": "2026-10-15T09:12:33.120Z",
  "payload": {
    "session_key": "claude_code:7f1e2d3c-4b5a-4c6d-8e7f-0a1b2c3d4e5f",
    "before_seq": 1830,
    "limit": 50,
    "kinds": [
      "turn_failed",
      "test_failed",
      "file_modified"
    ]
  }
}
