{
  "v": 1,
  "type": "event",
  "id": "01929f2a-7c00-7b3c-9e4d-00000000007f",
  "ts": "2026-10-15T09:12:33.120Z",
  "seq": 1817,
  "payload": {
    "event_id": "01929f1a-7a00-7b3c-9e4d-000000000012",
    "seq": 1817,
    "ts": "2026-10-15T09:12:33.120Z",
    "agent_kind": "claude_code",
    "session_key": "claude_code:7f1e2d3c-4b5a-4c6d-8e7f-0a1b2c3d4e5f",
    "kind": "test_failed",
    "category": "command",
    "severity": "warning",
    "summary": {
      "headline": "테스트가 실패했어요 (exit 101)"
    },
    "detail": {
      "command": "cargo test",
      "command_class": "test",
      "runner": "cargo",
      "exit_code": 101,
      "stderr_tail": "test pairing::expired ... FAILED"
    },
    "source": {
      "channel": "claude_code.hook.http",
      "native_ids": {
        "session_id": "7f1e2d3c-4b5a-4c6d-8e7f-0a1b2c3d4e5f"
      },
      "native_event": "PostToolUseFailure"
    },
    "redacted": false,
    "state_hint": "error",
    "project": {
      "project_key": "c:/dev/agentnest",
      "name": "agentnest",
      "path_hint": "…\\dev\\agentnest",
      "repo": "owner/agentnest",
      "branch": "feat/pairing"
    }
  }
}
