{
  "v": 1,
  "type": "pair_result",
  "id": "01929f2a-7c00-7b3c-9e4d-000000000077",
  "ts": "2026-10-15T09:12:33.120Z",
  "payload": {
    "ok": true,
    "device_id": "dev_8a1f3c5e7b9d2f4a6c8e0a1b3d5f7092",
    "device_token": "h_j9LwNrZhpuXLA-l2xZrvVHmemOB14QqVVTLCZH27Q",
    "pc": {
      "pc_id": "pc_8252e6280a3d81d1",
      "name": "DESKTOP-HOME",
      "app_version": "0.1.0",
      "os": "windows"
    }
  }
}
