{
  "v": 1,
  "type": "event",
  "id": "01929f2a-7c00-7b3c-9e4d-000000000080",
  "ts": "2026-10-15T09:12:33.120Z",
  "seq": 1822,
  "payload": {
    "event_id": "01929f1a-7a00-7b3c-9e4d-000000000017",
    "seq": 1822,
    "ts": "2026-10-15T09:12:33.120Z",
    "agent_kind": "claude_code",
    "session_key": "claude_code:7f1e2d3c-4b5a-4c6d-8e7f-0a1b2c3d4e5f",
    "kind": "approval_requested",
    "category": "approval",
    "severity": "info",
    "summary": {
      "headline": "허락을 기다리고 있어요"
    },
    "detail": {
      "request_id": "ar_01929f1a-6c2e-7b3c-9e4d-00000000001a",
      "risk": "high",
      "tool_name": "Bash",
      "title": "명령을 실행하려고 해요",
      "channel": "remote"
    },
    "source": {
      "channel": "claude_code.hook.http",
      "native_ids": {
        "request_id": "ar_01929f1a-6c2e-7b3c-9e4d-00000000001a",
        "session_id": "7f1e2d3c-4b5a-4c6d-8e7f-0a1b2c3d4e5f"
      },
      "native_event": "PermissionRequest"
    },
    "redacted": false,
    "state_hint": "awaiting_approval",
    "project": {
      "project_key": "c:/dev/agentnest",
      "name": "agentnest",
      "path_hint": "…\\dev\\agentnest",
      "repo": "owner/agentnest",
      "branch": "feat/pairing"
    }
  }
}
